{
  "schema_version": "1",
  "key": "sbi-cashback",
  "bank": "SBI",
  "card_name": "SBI Cashback Credit Card",
  "network": "VISA",
  "version": 1,
  "source_confidence": 0.9,
  "last_verified_at": "2026-01-15",
  "official_links": [
    "https://www.sbicard.com/en/personal/credit-cards/shopping/cashback-sbi-card.page"
  ],
  "community_links": ["https://www.technofino.in/"],
  "features": {
    "annual_fee": 999,
    "joining_fee": 999,
    "annual_fee_waiver_spend": 200000,
    "reward_type": "CASHBACK",
    "base_reward_rate": 1.0,
    "reward_value_per_point": 1.0,
    "rewards": [
      { "category": "online", "rate": 5.0, "unit": "percent", "cap": 5000, "notes": "5% online, capped 5000/month" },
      { "category": "offline", "rate": 1.0, "unit": "percent", "cap": null }
    ],
    "milestones": [],
    "reward_caps": [{ "category": "online", "monthly_cashback_cap": 5000 }],
    "exclusions": ["rent", "wallet", "fuel", "utilities_above_cap"],
    "lounge_access": { "domestic": 0, "international": 0 },
    "forex_markup_percent": 3.5,
    "fuel_surcharge_waiver": { "percent": 1.0, "max_per_statement": 250 },
    "benefits": ["5% cashback online", "Auto-credited cashback"],
    "redemption": { "mode": "statement_credit", "value_per_point": 1.0 }
  }
}
