{
  "schema_version": "1",
  "key": "hdfc-infinia",
  "bank": "HDFC",
  "card_name": "HDFC Infinia Credit Card",
  "network": "VISA",
  "version": 1,
  "source_confidence": 0.85,
  "last_verified_at": "2026-01-15",
  "official_links": [
    "https://www.hdfcbank.com/personal/pay/cards/credit-cards/infinia"
  ],
  "community_links": ["https://www.technofino.in/"],
  "features": {
    "annual_fee": 12500,
    "joining_fee": 12500,
    "annual_fee_waiver_spend": 1000000,
    "reward_type": "REWARD_POINTS",
    "base_reward_rate": 3.3,
    "reward_value_per_point": 1.0,
    "rewards": [
      { "category": "other_spends", "rate": 3.3, "unit": "points_per_150", "cap": null },
      { "category": "smartbuy_travel", "rate": 16.5, "unit": "points_per_150", "cap": null, "notes": "up to 5x on SmartBuy" }
    ],
    "milestones": [],
    "reward_caps": [{ "category": "insurance", "monthly_points_cap": 50000 }],
    "exclusions": ["fuel", "wallet", "rent"],
    "lounge_access": { "domestic": "unlimited", "international": "unlimited" },
    "forex_markup_percent": 2.0,
    "fuel_surcharge_waiver": { "percent": 1.0, "max_per_statement": 1000 },
    "benefits": ["Unlimited lounge access", "Golf", "Concierge", "1% fuel surcharge waiver"],
    "redemption": { "mode": "smartbuy", "value_per_point": 1.0 }
  }
}
