{
  "schema_version": "1",
  "key": "icici-amazon-pay",
  "bank": "ICICI",
  "card_name": "Amazon Pay ICICI Credit Card",
  "network": "VISA",
  "version": 1,
  "source_confidence": 0.9,
  "last_verified_at": "2026-01-15",
  "official_links": [
    "https://www.icicibank.com/personal-banking/cards/credit-card/amazon-pay-credit-card"
  ],
  "community_links": ["https://www.technofino.in/"],
  "features": {
    "annual_fee": 0,
    "joining_fee": 0,
    "annual_fee_waiver_spend": null,
    "reward_type": "CASHBACK",
    "base_reward_rate": 1.0,
    "reward_value_per_point": 1.0,
    "rewards": [
      { "category": "amazon_prime", "rate": 5.0, "unit": "percent", "cap": null, "notes": "5% for Prime members on Amazon" },
      { "category": "amazon_non_prime", "rate": 3.0, "unit": "percent", "cap": null },
      { "category": "amazon_pay_partners", "rate": 2.0, "unit": "percent", "cap": null },
      { "category": "other_spends", "rate": 1.0, "unit": "percent", "cap": null }
    ],
    "milestones": [],
    "reward_caps": [],
    "exclusions": ["rent", "wallet_load", "emi"],
    "lounge_access": { "domestic": 0, "international": 0 },
    "forex_markup_percent": 3.5,
    "fuel_surcharge_waiver": { "percent": 1.0, "max_per_statement": null },
    "benefits": ["No annual fee", "No reward expiry on Amazon Pay balance"],
    "redemption": { "mode": "amazon_pay_balance", "value_per_point": 1.0 }
  }
}
